{
  "schema_version": "1.1.0",
  "request_id": "55555555-5555-4555-8555-555555555564",
  "provider": "synthetic-fixture-weather-provider",
  "capability": "weather",
  "data_mode": "unavailable",
  "status": "timeout",
  "retrieved_at": "2026-08-01T12:00:00Z",
  "source_urls": [],
  "quality": {
    "schema_version": "1.0.0",
    "completeness": 0.0,
    "freshness": "unavailable",
    "assumptions": ["Weather provider call exceeded its bounded timeout; plan built weather-neutral per architecture.md §13.5."]
  },
  "result": {
    "schema_version": "1.0.0",
    "location": "Istanbul, Turkey",
    "timezone": "Europe/Istanbul",
    "kind": "unavailable",
    "units": { "temperature": "C", "wind_speed": "kmh", "precipitation": "mm" },
    "forecast_days": [],
    "missing_fields": ["forecast_days"]
  }
}
