{
  "schema_version": "1.0.0",
  "request_id": "55555555-5555-4555-8555-555555555553",
  "provider": "inside-airbnb-snapshot",
  "data_mode": "historical",
  "retrieved_at": "2026-08-01T12:00:00Z",
  "valid_for": "P30D",
  "currency": "TRY",
  "source_urls": ["https://example-synthetic-source.voyagerai.dev/inside-airbnb"],
  "quality": {
    "schema_version": "1.0.0",
    "completeness": 0.94,
    "freshness": "historical",
    "assumptions": ["Snapshot reflects listing state on collection date only."]
  },
  "result": {
    "stays": [
      {
        "schema_version": "1.0.0",
        "stay_id": "stay_001",
        "name": "Synthetic Sultanahmet Loft",
        "district_id": "district_fatih",
        "side": "european",
        "coordinates": { "lat": 41.0055, "lon": 28.9769 },
        "nightly_price": { "amount_minor_units": 220000, "currency": "TRY" },
        "rating": 4.6,
        "review_count": 128,
        "amenities": ["wifi", "air_conditioning"],
        "provenance": {
          "schema_version": "1.0.0",
          "provider": "inside-airbnb-snapshot",
          "data_mode": "historical",
          "retrieved_at": "2026-08-01T12:00:00Z",
          "valid_for": "P30D",
          "source_urls": ["https://example-synthetic-source.voyagerai.dev/inside-airbnb"]
        }
      },
      {
        "schema_version": "1.0.0",
        "stay_id": "stay_002",
        "name": "Synthetic Kadikoy Studio",
        "district_id": "district_kadikoy",
        "side": "asian",
        "coordinates": { "lat": 40.9908, "lon": 29.0281 },
        "nightly_price": { "amount_minor_units": 150000, "currency": "TRY" },
        "rating": 4.3,
        "review_count": 64,
        "amenities": ["wifi"],
        "provenance": {
          "schema_version": "1.0.0",
          "provider": "inside-airbnb-snapshot",
          "data_mode": "historical",
          "retrieved_at": "2026-08-01T12:00:00Z",
          "valid_for": "P30D",
          "source_urls": ["https://example-synthetic-source.voyagerai.dev/inside-airbnb"]
        }
      }
    ]
  }
}
