{
  "schema_version": "1.1.0",
  "request_id": "55555555-5555-4555-8555-555555555563",
  "provider": "synthetic-fixture-web-search-provider",
  "capability": "web_search",
  "data_mode": "unavailable",
  "status": "unavailable",
  "retrieved_at": "2026-08-01T12:00:00Z",
  "source_urls": [],
  "quality": {
    "schema_version": "1.0.0",
    "completeness": 0.0,
    "freshness": "unavailable",
    "assumptions": [
      "Web-search provider unavailable; no evidence retrieved. Never substituted with frozen RAG citations or fabricated evidence."
    ]
  },
  "result": {
    "schema_version": "1.0.0",
    "original_query": "Hagia Sophia current visiting hours",
    "normalized_query": "hagia sophia visiting hours",
    "items": []
  }
}
