{
  "schema_version": "1.1.0",
  "request_id": "55555555-5555-4555-8555-555555555562",
  "provider": "synthetic-fixture-web-search-provider",
  "capability": "web_search",
  "data_mode": "fixture",
  "status": "success",
  "retrieved_at": "2026-08-01T12:00:00Z",
  "source_urls": ["https://example-synthetic-source.voyagerai.dev/hagia-sophia-visiting"],
  "quality": {
    "schema_version": "1.0.0",
    "completeness": 1.0,
    "freshness": "fixture",
    "assumptions": ["Synthetic deterministic web-evidence fixture; not a live search."]
  },
  "result": {
    "schema_version": "1.0.0",
    "original_query": "Hagia Sophia current visiting hours",
    "normalized_query": "hagia sophia visiting hours",
    "items": [
      {
        "title": "Hagia Sophia Mosque - Official Visitor Information",
        "canonical_url": "https://example-synthetic-source.voyagerai.dev/hagia-sophia-visiting",
        "publisher": "Example Synthetic Ministry of Culture",
        "published_at": "2026-06-01T00:00:00Z",
        "retrieved_at": "2026-08-01T12:00:00Z",
        "snippet": "The mosque is open to visitors outside of the five daily prayer times.",
        "language": "en",
        "rank": 1,
        "freshness": "fixture",
        "source_type": "official",
        "provenance": {
          "schema_version": "1.0.0",
          "provider": "synthetic-fixture-web-search-provider",
          "data_mode": "fixture",
          "retrieved_at": "2026-08-01T12:00:00Z",
          "source_urls": ["https://example-synthetic-source.voyagerai.dev/hagia-sophia-visiting"]
        }
      }
    ]
  }
}
